1ID,Abbr,Full,Source
2,AA,Archäologischer Anzeiger,L’Erma
3,AAAd,Antichità altoadriatiche,L’Erma
4,ABSA,The annual of the British school at Athens,L’Erma
5,ACME,Acme. Annali della facoltà di lettere e filosofia dell'università degli studi di Milano,L’Erma
6,ACS,Archivio centrale dello stato (salvo diversa indicazione si fa riferimento ai fondi del Ministero della Pubblica Istruzione, Direzione Generale Antichità e Belle Arti),L’Erma
7,AE,L'Année épigraphique,L’Erma
8,AIONArchStAnt,Annali dell'istituto universitario orientale di Napoli. Dipartimento di studi del mondo classico e del Mediterraneo antico. Sezione di archeologia e storia antica,L’Erma
9,AJA,American Journal of Archaeology,L’Erma
10,AM,Mitteilungen des Deutschen Archäologischen Instituts. Athenische Abteilung,L’Erma
11,AMDSPMarche,Atti e memorie della deputazione di storia patria per le Marche,L’Erma
12,AMST,Atti e memorie della societd tiburtina di storia e d'arte,L’Erma
13,AnnalesESC,Annales. economies, sociétés, civilisations,L’Erma
14,Annlnst,Annali pubblicati dall'instituto di corrispondenza archeologica,L’Erma
15,AnninstltNum,Annali. Istituto italiano di numismatica,L’Erma
16,ANRW,Aufstieg und Niedergang der romischen Welt,L’Erma
17,AnScAt,Annuario della scuola archeologica di Atene e delle missioni italiane in Oriente,L’Erma
18,AntCl,L'Antiquité classique,L’Erma
19,AntK,Antike Kunst,L’Erma
20,AqN,Aquileia nostra,L’Erma
21,Arch Cl,Archeologia classica,L’Erma
22,ASNP,Annali della scuola normale superiore di Pisa. Classe di lettere e filosofia,L’Erma
23,ASR,Archivio di stato di Roma,L’Erma
24,ASRP,Archivio della società romana di storia patria,L’Erma
25,ATTA,Atlante tematico di topografia antica,L’Erma
26,Atti Taranto,Atti del convegno di studi sulla Magna Grecia,L’Erma
27,AttiMemProvM,Atti e memorie della deputazione di storia patria per le antiche province modenesi,L’Erma
28,AttiMemProvR,Atti e memorie. Deputazione di storia patria per le province di Romagna,L’Erma
29,AttiMGrecia,Atti e memorie della società Magna Grecia,L’Erma
30,BA,Bollettino d'arte,L’Erma
31,BaBesch,Bulletin antieke beschaving. Annual papers on classical archaeology,L’Erma
32,BAR,British archaeological reports,L’Erma
33,BC,Bullettino della commissione archeologica comunale di Roma,L’Erma
34,BCH,Bulletin de correspondance hellénique,L’Erma
35,BdA,Bollettino di archeologia,L’Erma
36,BDSPUmbria,Bollettino della regia deputazione di storia patria per l'Umbria,L’Erma
37,BEFAR,Bibliotheque des écoles francaises d'Athènes et de Rome,L’Erma
38,BIASA,Biblioteca dell'istituto nazionale di archeologia e storia dell'arte (Roma),L’Erma
39,BollSocGeogr,Bollettino della società geografica italiana,L’Erma
40,BonnJ,Bonner Jahrbücher,L’Erma
41,BPI,Bullettino di paletnologia italiana,L’Erma
42,BSBS,Bollettino storico-bibliografico subalpino,L’Erma
43,BSC,Bollettino storico cremonese,L’Erma
44,BSM,Bollettino dell'associazione internazionale degli studi mediterranei,L’Erma
45,BTCGI,Bibliografia topografica della colonizzazione greca in Italia e nelle isole tirreniche,L’Erma
46,BullInst,Bullettino dell'instituto di corrispondenza archeologica,L’Erma
47,BV,Biblioteca apostolica vaticana (Roma),L’Erma
48,CARB,Corsi di cultura sull'arte ravennate e bizantina,L’Erma
49,CIE,Corpus inscriptionum etruscarum,L’Erma
50,CIL,Corpus inscriptionum latinarum,L’Erma
51,CivP,Civiltà padana. Archeologia e storia del territorio,L’Erma
52,Cod.Vat.Lat.,Codice vaticano latino (biblioteca apostolica vaticana),L’Erma
53,CollEFR,Collection de l'ecole francaise de Rome,L’Erma
54,CRAI,Comptes rendus des seances de l'académie des inscriptions et belles-lettres,L’Erma
55,CVA,Corpus vasorum antiquorum,L’Erma
56,DdA,Dialoghi di archeologia,L’Erma
57,DE,E. De Ruggiero, Dizionario epigrafico di antichità romane, i-, Roma 1895-,L’Erma
58,DissPontAcc,Dissertazioni della pontificia accademia romana di archeologia,L’Erma
59,EAA,Enciclopedia dell'arte antica, classica e orientale,L’Erma
60,EAM,Enciclopedia dell'arte medioevale,L’Erma
61,EE,Ephemeris epigraphica,L’Erma
62,EL,Enciclopedia italiana,L’Erma
63,EOr,Enciclopedia oraziana,L’Erma
64,EVir,Enciclopedia virgiliana,L’Erma
65,FA,Fasti archaeologici,L’Erma
66,FelRav,Felix Ravenna,L’Erma
67,IG,Inscriptiones grecae,L’Erma
68,IGM,Istituto geografico militare (Firenze),L’Erma
69,ILLRP,A. Degrassi, Inscriptiones latinae liberae rei publicae, Firenze 1957-1963,L’Erma
70,ILS,H. Dessau, Inscriptiones latinae selectae, Berolini 1892-1916,L’Erma
71,JAT,Journal of ancient topography,L’Erma
72,JdI,Jarhbuch des Deutschen Archäologischen Instituts,L’Erma
73,JFA,Journal of field archaeology,L’Erma
74,JRA,Journal of Roman archaeology,L’Erma
75,JRS,Journal of Roman studies,L’Erma
76,LIMC,Lexicon iconographicum mythologiae classicae,L’Erma
77,MAAR,Memoirs of the American academy in Rome,L’Erma
78,MededRom,Mededelingen van het Nederlands Historisch Instituut te Rome,L’Erma
79,MEFR,Mélanges d'archéologie et d'histoire (ecole francaise de Rome) (fino al volume 82, 1970),L’Erma
80,MEFRA,Mélanges de l'ecole francaise de Rome. Antiquité (dal 1971),L’Erma
81,MEFRM,Mélanges de l'ecole francaise de Rome. Moyen-âge, temps modernes,L’Erma
82,MemAL,Memorie. Atti dell'accademia nazionale dei lincei. Classe di scienze morali, storiche e filologiche,L’Erma
83,MemPontAcc,Memorie della pontificia accademia romana di archeologia,L’Erma
84,MonAL,Monumenti antichi pubblicati per cura dell'accademia nazionale dei lincei,L’Erma
85,Monlnst,Monumenti dell'istituto di corrispondenza archeologica,L’Erma
86,NotALomb,Notiziario. Soprintendenza archeologica della Lombardia,L’Erma
87,NS,Notizie degli scavi di antichità,L’Erma
88,Ojh,Jahreshefte des Österreischen Archäologischen Institutes in Wien,L’Erma
89,OpRom,Opuscula romana (Acta inst. rom. regni sueciae),L’Erma
90,ParPass,La parola del passato,L’Erma
91,PBSR,Papers of the British School at Rome,L’Erma
92,QdAV,Quaderni di archeologia del Veneto,L’Erma
93,QS,Quaderni di storia,L’Erma
94,QuadAEI,Quaderni del centro di studio per l'archeologia etrusco-italica (fino al volume 18, 1990); Quaderni di archeologia etrusco-italica (dal volume 19, 1990),L’Erma
95,QuadAPiem,Quaderni della soprintendenza archeologica del Piemonte,L’Erma
96,QuadlstTopA,Quaderni dell'istituto di topografia antica dell'università di Roma,L’Erma
97,QuadStLun,Quaderni di studi lunensi,L’Erma
98,PA,Revue archéologique,L’Erma
99,RAC,Rivista di archeologia cristiana,L’Erma
100,RaComo,Rivista archeologica dell'antica provincia e diocesi di Como,L’Erma
101,RAF,The Royal Air Force,L’Erma
102,RAL,Rendiconti della Classe di scienze morali, storiche e filologiche dell'Accademia Nazionale dei Lincei,L’Erma
103,RANap,Rendiconti dell'Accademia di archeologia, lettere e belle arti, Napoli,L’Erma
104,RANarb,Revue archéologique de Narbonnaise,L’Erma
105,RdA,Rivista di archeologia,L’Erma
106,RE,Pauly-Wissowa, Paulys Realencyclopädie der classischen Altertumswissenschaft,L’Erma
107,REA,Revue des études anciennes,L’Erma
108,REE,Rivista di epigrafia etrusca (in Studi Etruschi),L’Erma
109,RendPontAcc,Rendiconti della Pontificia Accadernia romana di archeologia,L’Erma
110,RFIC,Rivista di filologia e di istruzione classica,L’Erma
111,RIASA,Rivista dell'Istituto nazionale d'archeologia e storia dell'arte,L’Erma
112,RIL,Rendiconti dell'Istituto lombardo. Classe di Lettere, Scienze morali e storiche,L’Erma
113,RM,Mitteilungen des Deutschen Archäologischen Instituts. Römische Abteilung,L’Erma
114,RSL,Rivista di studi liguri,L’Erma
115,RSP,Rivista di studi pompeiani,L’Erma
116,ScAnt,Scienze dell'Antichità. Storia, archeologia, antropologia,L’Erma
117,SCO,Studi classici e orientali,L’Erma
118,SR,Studi romagnoli,L’Erma
119,StAnt,Studi di antichità. Università di Lecce,L’Erma
120,StEtr,Studi etruschi,L’Erma
121,StMac,Studi maceratesi,L’Erma
122,StMisc,Studi miscellanei. Seminario di archeologia e storia dell'arte greca e romana dell'Università di Roma,L’Erma
123,StPic,Studia picena,L’Erma
124,StRom,Studi romani,L’Erma
125,ThLL,Thesaurus Linguae Latinae,L’Erma
126,ZPE,Zeitschrift für Papyrologie und Epigraphik,L’Erma
127,ABL,C.H.E. Haspels, Attic Black-Figured Lekythoi (Paris 1936),AJA
128,ABV,J.D. Beazley, Attic Black-Figure Vase-Painters (Oxford 1956),AJA
129,AÉpigr,L’Année épigraphique: Revue des publications épigraphiques relatives a l’antiquité romaine (Paris 1888– ),AJA
130,AntCr,D. Levi and G. Rizza, Antichità cretesi: Studi in onore di Doro Levi. 2 vols. (Catania 1973–1974),AJA
131,ANRW,H. Temporini, ed., Aufstieg und Niedergang der römischen Welt (Berlin 1972– ),AJA
132,ArchHom,F. Matz and H.G. Buchholz, eds., Archaeologia Homerica (Göttingen 1967– ),AJA
133,ARV²,J.D. Beazley, Attic Red-Figure Vase-Painters. 2nd ed. (Oxford 1963),AJA
134,ASR,C. Robert et al., Die antiken Sarkophagreliefs (Berlin 1890– ),AJA
135,BAPD,Beazley Archive Pottery Database (www.beazley.ox.ac.uk),AJA
136,Beazley Addenda²,T.H. Carpenter et al., Beazley Addenda: Additional References to ABV, ARV² and Paralipomena. 2nd ed. (Oxford 1989),AJA
137,Benndorf-Schöne,O. Benndorf and O. Schöne, Die antiken Bildwerke des Lateranensischen Museums (Leipzig 1867),AJA
138,BMC,R.S. Poole, Catalogue of the Greek Coins in the British Museum (London 1873– ),AJA
139,BMCRE,H. Mattingly, Coins of the Roman Empire in the British Museum (London 1923– ),AJA
140,BMCRR,H.A. Grueber, Coins of the Roman Republic in the British Museum (London 1910),AJA
141,BrBr,H. Brunn, Denkmäler griechischer und römischer Sculptur in historischer Anordnung (Munich 1888–1911),AJA
142,CAD,The Assyrian Dictionary of the Oriental Institute of the University of Chicago (Chicago 1956–2010),AJA
143,CAT,C.W. Clairmont, Classical Attic Tombstones (Kilchberg 1993),AJA
144,CB,L.D. Caskey and J.D. Beazley, Attic Vase Paintings in the Museum of Fine Arts, Boston (Oxford 1931–1963),AJA
145,CoMIK,J. Chadwick et al., Corpus of Mycenaean Inscriptions from Knossos (Cambridge 1986–1998),AJA
146,CIA,Königlich Preussische Akademie der Wissenschaften zu Berlin, Corpus inscriptionum atticarum (Berlin 1873–1897),AJA
147,CIE,C. Pauli et al., Corpus inscriptionum etruscarum (Rome 1964– [repr. of Leipzig 1893–1936]),AJA
148,CIG,A. Boeckh et al., Corpus inscriptionum graecarum (Berlin 1828–1877),AJA
149,CII,J.B. Frey, Corpus inscriptionum iudicarum (New York 1975),AJA
150,CIL,Königlich Preussische Akademie der Wissenschaften zu Berlin, Corpus inscriptionum latinarum (Berlin 1893–),AJA
151,CIS,Académie des inscriptions et belles-lettres, Corpus inscriptionum semiticarum (Paris 181–1962),AJA
152,CMS,F. Matz, Corpus der minoischen und mykenischen Siegel (Berlin 1964– ),AJA
153,CVA,Corpus vasorum antiquorum (Paris 1923– ),AJA
154,DACL,F. Cabrol and E. Leclercq, Dictionnaire d’archéologie chrétienne et de liturgie (Paris 1907–1953),AJA
155,DarSag,C. Daremberg and E. Saglio, Dictionnaire des antiquités grecques et romaines (Paris 1875),AJA
156,Docs¹,M. Ventris and J. Chadwick, Documents in Mycenaean Greek (Cambridge 1956),AJA
157,Docs²,M. Ventris and J. Chadwick, Documents in Mycenaean Greek. 2nd ed. (Cambridge 1973),AJA
158,EA,P. Arndt and W. Amelung, Photographische Einzelaufnahmen antiker Skulpturen (Munich 1893–1940),AJA
159,EAA,Enciclopedia dell’arte antica, classica e orientale (Rome 1958–1984),AJA
160,ES,E. Gerhard et al., Etruskische Spiegel (Berlin 1843–1897),AJA
161,Espérandieu,E. Espérandieu, Recueil général des bas-reliefs, statues, et bustes de la Gaule romaine (Paris 1907– ),AJA
162,ET,H. Rix, Etruskische Texte: Editio minor (Tübingen 1991),AJA
163,EVP,J.D. Beazley, Etruscan Vase Painting (Oxford 1947),AJA
164,FGrHist,F. Jacoby, Fragmente der griechischen Historiker (Berlin 1923– ),AJA
165,FHG,K. Müller, Fragmenta historicorum graecorum (Frankfurt 1975 [repr. of 1841–1938 ed.]),AJA
166,FR,A. Furtwängler and K. Reichhold, Griechische Vasenmalerei (Munich 1900–1925),AJA
167,FRHist,T.J. Cornell, ed., The Fragments of the Roman Historians. 3 vols. (Oxford 2013),AJA
168,GCH,C. Kraay et al., An Inventory of Greek Coin Hoards (New York 1973),AJA
169,Gercke-Norden,A. Gercke and E. Norden, Einleitung in die Altertumswissenschaft (Leipzig 1910–1912),AJA
170,GGR³,M.P. Nilsson, Geschichte der griechischen Religion. 3rd ed. (Munich 1967),AJA
171,GORILA,L. Godart and J.-P. Olivier, Recueil des inscriptions en Linéaire A (Paris 1976– ),AJA
172,GrCirclB,G.E. Mylonas, Grave Circle B of Mycenae (Lund 1964),AJA
173,HdA,Handbuch der Archäologie (Berlin 1931– ),AJA
174,Helbig⁴,W. Helbig, Führer durch die öffentlichen Sammlungen klassischer Altertümer in Rom. 4th ed. (Tübingen 1963–1972),AJA
175,Heldensage³,F. Brommer, Vasenlisten zur griechischen Heldensage. 3rd ed. (Marburg 1973),AJA
176,ICr,M. Guarducci and F. Halbherr, Inscriptiones creticae (Rome 1935–1950),AJA
177,ID,F. Dürrbach et al., Inscriptions de Délos (Paris 1926– ),AJA
178,IG,M. Fraenkel, Inscriptiones graecae (Berlin 1895– ),AJA
179,IGLSyr,L. Jalabert and R. Mouterde, Inscriptions grecques et latines de la Syrie (Paris 1929–[1986]),AJA
180,IGRR,R. Cagnat, Inscriptiones graecae ad res romanas pertinentes (Chicago 1975),AJA
181,II,A. Ferrua and A. Garzetti, Inscriptiones Italiae (Rome 1948–1986),AJA
182,ILLRP,H. Degrassi, Inscriptiones latinae liberae rei publicae (Rome 1957– ),AJA
183,ILS,H. Dessau, ed., Inscriptiones latinae selectae (Berlin 1892–1916),AJA
184,IsMEO,Istituto italiano per il Medio ed Estremo Oriente,AJA
185,IvE,H. Wankel et al., Die Inschriften von Ephesos (Bonn 1979–1984),AJA
186,Karo,G. Karo, Die Schachtgräber von Mykenai (Munich 1930–1933),AJA
187,KBo,Keilschrifttexte aus Boghazköi (Leipzig and Berlin 1916– ),AJA
188,KUB,Keilschrifturkunden aus Boghazköi (Berlin 1922– ),AJA
189,KirchPA,J.E. Kirchner, Prosopographia attica (Chicago 1981 [repr. of 1901–1903 ed.]),AJA
190,KlPauly,K. Ziegler et al., eds., Der kleine Pauly: Lexicon der Antike (Munich 1964–1975),AJA
191,LGPN,Lexicon of Greek Personal Names (Oxford 1987– ),AJA
192,LIMC,J. Boardman, Lexicon iconographicum mythologiae classicae (Zurich 1981–2009),AJA
193,LIMC Online,LIMCicon Database (www.limc-france.fr),AJA
194,LSJ⁹,H.G. Liddell et al., Greek-English Lexicon. 9th ed. (Oxford 1940),AJA
195,LSJ Online,The Online Liddell-Scott-Jones Greek-English Lexicon (www.tlg.uci.edu/lsj),AJA
196,LTUR,E.M. Steinby, ed., Lexicon topographicum urbis romae (Rome 1993),AJA
197,LTURS,A. La Regina, ed., Lexicon topographicum urbis Romae: Suburbium (Rome 2001–2008),AJA
198,Matz-Duhn,F. Matz and F. von Duhn, Antike Bildwerke in Rom (Leipzig 1881–1882),AJA
199,Migne, PG,J.P. Migne, Patrologia graeca (Paris 1928–1936),AJA
200,Migne, PL,J.P. Migne, Patrologia latina (Paris 1879),AJA
201,MMR²,M.P. Nilsson, The Minoan-Mycenaean Religion. 2nd ed. (Lund 1950),AJA
202,Nash²,E. Nash, Pictorial Dictionary of Ancient Rome. 2nd ed. (New York 1968),AJA
203,NTDAR,L. Richardson, A New Topographical Dictionary of Ancient Rome (Baltimore 1992),AJA
204,Neue Pauly,H. Cancik and H. Schneider, eds., Der neue Pauly: Enzyklopädie der Antike (Stuttgart 1996–2003),AJA
205,New Pauly, Antiquity,H. Cancik and H. Schneider, eds., Brill’s New Pauly: Encyclopaedia of the Ancient World. Antiquity (Boston 2002–2010),AJA
206,New Pauly, Classical,M. Landfester et al., eds., Brill’s New Pauly: Encyclopaedia of the Ancient World. Classical Tradition (Boston 2006–2011),AJA
207,New Pauly Online,Brill Online Reference Works (http://referenceworks.brillonline.com/browse/brill-s-new-pauly),AJA
208,OCD,The Oxford Classical Dictionary,AJA
209,OLD,Oxford Latin Dictionary,AJA
210,Paralipomena,J.D. Beazley, Paralipomena (Oxford 1971),AJA
211,PECS,R. Stillwell et al., eds., Princeton Encyclopedia of Classical Sites (Princeton 1976),AJA
212,PGC,H.G. Buchholz and V. Karageorghis, Prehistoric Greece and Cyprus (London 1973),AJA
213,PIR²,Prosopographia Imperii Romani. 2nd ed. (Berlin and Leipzig 1933–2015),AJA
214,Platner-Ashby,S.B. Platner and T. Ashby, A Topographical Dictionary of Ancient Rome (London 1929),AJA
215,RE,A. Pauly and G. Wissowa, Real-Encyclopädie der Classischen Altertumswissenschaft (1893–1978),AJA
216,RIC,H. Mattingly et al., The Roman Imperial Coinage (London 1923– ),AJA
217,RIC²,H. Mattingly et al., The Roman Imperial Coinage. 2nd rev. ed. (London 2007– ),AJA
218,Roscher,W.H. Roscher, Ausführliches Lexikon der griechischen und römischen Mythologie (Leipzig 1884–1937),AJA
219,RSGR,S. Reinach, Répertoire de la statuaire grecque et romaine (Paris 1897–1924),AJA
220,RVAp,A.D. Trendall and A. Cambitoglou, The Red-Figured Vases of Apulia (Oxford 1978– ),AJA
221,SEG,Supplementum epigraphicum graecum (Leiden 1923–),AJA
222,SIG,W. Dittenberger, Sylloge inscriptionum graecarum (Leipzig 1883– ),AJA
223,SNG,British Academy, Sylloge nummorum graecorum (London 1931– ),AJA
224,Stuart Jones, Cap.,H. Stuart Jones, A Catalogue of the Ancient Sculptures Preserved in the Municipal Collections of Rome: The Sculptures of the Museo Capitolino (Oxford 1926),AJA
225,Stuart Jones, Cons.,H. Stuart Jones, A Catalogue of the Ancient Sculptures Preserved in the Municipal Collections of Rome: The Sculptures of the Palazzo dei Conservatori (Oxford 1912),AJA
226,ThLE,M. Pallottino and M.P. Angeletti, Thesaurus linguae etruscae (Rome 1978– ),AJA
227,TKB,G. Mylonas, O taphikos kyklos B ton Mykenon (Athens 1972–1973),AJA
228,TLE²,M. Pallottino, Testimonia linguae etruscae. 2nd ed. (Florence 1968),AJA
229,TLG³,L. Berkowitz et al., Thesaurus Linguae Graecae Canon of Greek Authors and Works. 3rd ed. (Oxford 1990),AJA
230,TLG,Online Thesaurus Linguae Graecae: A Digital Library of Greek Literature (www.tlg.uci.edu),AJA
231,TLL,R. Estienne and J. Hollins, Thesaurus linguae latinae (London 1734–1735),AJA
232,Travlos, Athens,I. Travlos, Pictorial Dictionary of Ancient Athens (London 1971),AJA
233,Travlos, Attika,I. Travlos, Bildlexikon zur Topographie des antiken Attika (Tübingen 1988),AJA
234,A&A,Antike und Abendland,AJA
235,AA,Archäologischer Anzeiger,AJA
236,AAA,Athens Annals of Archaeology,AJA
237,AAES,Publications of an American Archaeological Expedition to Syria,AJA
238,AAS,Annales archéologiques arabes syriennes,AJA
239,AAs,Arts asiatiques (formerly RAA),AJA
240,AASOR,Annual of the American Schools of Oriental Research,AJA
241,AbhBerl,Abhandlungen der Deutschen Akademie der Wissenschaften zu Berlin,AJA
242,AbhGött,Abhandlungen der Akademie der Wissenschaften zu Göttingen,AJA
243,AbhHeid,Abhandlungen der Heidelberger Akademie der Wissenschaften,AJA
244,AbhKM,Abhandlungen für die Kunde des Morgenlandes,AJA
245,AbhLeip,Abhandlungen der Sächsischen Akademie der Wissenschaften zu Leipzig, Philologisch-historische Klasse,AJA
246,AbhMainz,Abhandlungen der Geistes- und Sozialwissenschaftlichen Klasse, Akademieder Wissenschaften und der Literatur in Mainz,AJA
247,AbhMünch,Bayerische Akademie der Wissenschaften, München, Philosophisch-historische Klasse: Abhandlungen,AJA
248,Acme,Acme: Annali della Facoltà di Filosofia e Lettere dell’Università statale di Milano,AJA
249,ACNAC,Ancient Coins in North American Collections,AJA
250,ActaAArtHist,Acta ad archaeologiam et artium historiam pertinentia,AJA
251,ActaArch,Acta archaeologica (Copenhagen),AJA
252,ActaArchHung,Acta archaeologica Academiae scientiarum Hungaricae,AJA
253,ActaArchLov,Acta archaeologica Lovanensia,AJA
254,ActaAth,Skrifter utgivna av Svenska Institutet i Athen (Acta Instituti Atheniensis Regni Sueciae) (formerly SkrAth),AJA
255,ActaInstRomFin,Acta Instituti romani Finlandiae,AJA
256,ActaLund,Acta Universitatis Lundensis,AJA
257,ActaNum,Acta numismatica,AJA
258,ActaOrHung,Acta orientalia Academiae scientiarum Hungaricae,AJA
259,ActaRom,Skrifter utgivna av Svenska Institutet i Rom (Acta Instituti Romani Regni Sueciae) (formerly SkrRom),AJA
260,ADAJ,Annual of the Department of Antiquities of Jordan,AJA
261,AdI,Annali dell’Istituto di corrispondenza archeologica,AJA
262,Aegaeum,Aegaeum: Annales d’archéologie égéenne de l’Université de Liège,AJA
263,ÄgForsch,Ägyptologische Forschungen,AJA
264,AEM,Archäologisch epigraphische Mitteilungen aus Österreich-Ungarn,AJA
265,AeR,Atene e Roma,AJA
266,Aevum,Aevum: Rassegna di scienze storiche, linguistiche e filologiche,AJA
267,AF,Archäologische Forschungen,AJA
268,AfO,Archiv für Orientforschung,AJA
269,Africa,Africa: Institut national d’Archéologie et d’Art (Tunis),AJA
270,AfrIt,Africa italiana,AJA
271,AfrRom,L’Africa romana,AJA
272,Agora,Athenian Agora (Princeton 1953– ),AJA
273,AgoraPicBk,Excavations of the Athenian Agora: Picture Book (Princeton 1958– ),AJA
274,AHR,American Historical Review,AJA
275,AIABull,Bulletin of the Archaeological Institute of America,AJA
276,AIANews,Newsletter of the Archaeological Institute of America,AJA
277,AIIN,Annali dell’Istituto Italiano di Numismatica,AJA
278,AION,Annali dell’Istituto universitario orientali di Napoli,AJA
279,AJA,American Journal of Archaeology,AJA
280,AJAH,American Journal of Ancient History,AJA
281,AJN,American Journal of Numismatics,AJA
282,AJP,American Journal of Philology,AJA
283,AJSL,American Journal of Semitic Languages and Literatures,AJA
284,Akkadica,Akkadica: Périodique bimestriel de la Fondation assyriologique Georges Dossin,AJA
285,Altertum,Das Altertum,AJA
286,AltO,Der alte Orient,AJA
287,AM,Mitteilungen des Deutschen Archäologischen Instituts, Athenische Abteilung,AJA
288,AM-BH,Mitteilungen des Deutschen Archäologischen Instituts, Athenische Abteilung: Beiheft,AJA
289,AmerAnt,American Antiquity,AJA
290,AMIran,Archäologische Mitteilungen aus Iran,AJA
291,Ampurias,Ampurias: Revista de prehistoria, arqueología y etnología,AJA
292,AmtlBer,Amtliche Berichte aus den königlichen Kunstsammlungen,AJA
293,AMUGS,Antike Münzen und geschnittene Steine,AJA
294,Anadolu,Anadolu: Revue annuelle des études d’archéologie et d’histoire en Turquie,AJA
295,AnalBoll,Analecta Bollandiana,AJA
296,AnalFran,Analecta Franciscana,AJA
297,AnalOr,Analecta Orientalia,AJA
298,AnalRom,Analecta Romana Instituti Danici,AJA
299,Anatolia,Anatolia: Revue annuelle de l’Institut d’archéologie de l’Université d’Ankara,AJA
300,Anatolica,Anatolica: Annuaire international pour les civilisations de l’Asie antérieure,AJA
301,AnatSt,Anatolian Studies,AJA
302,AncEg,Ancient Egypt,AJA
303,AncW,The Ancient World,AJA
304,AnnAcFenn,Annales Academiae scientiarum Fennicae,AJA
305,AnnArch,Annales archéologiques,AJA
306,AnnArchBrux,Annales de la Société royale d’archéologie de Bruxelles,AJA
307,AnnArchStorAnt,Annali del Seminario di studi del mondo classico: Sezione di archeologia e storia antica,AJA
308,AnnBari,Annali della Facoltà di Lettere e Filosofia, Università di Bari,AJA
309,AnnÉconSocCiv,Annales: Économie, sociétés, civilisations,AJA
310,AnnFaina,Annali della Fondazione per il Museo “Claudio Faina”,AJA
311,AnnInst,Annales Institutorum,AJA
312,AnnLiv,Annals of Archaeology and Anthropology (Liverpool),AJA
313,AnnLux,Annales de l’Institut archéologique du Luxembourg (Arlon),AJA
314,AnnNap,Annali della Facoltà di Lettere e Filosofia, Università di Napoli,AJA
315,AnnParis,Annales de l’Université de Paris,AJA
316,AnnPerugia,Annali della Facoltà di Lettere e Filosofia, Università degli studi di Perugia,AJA
317,AnnPhilHist,Annuaire, Institut de philologie et d’histoire, Université libre, Bruxelles,AJA
318,AnnPisa,Annali della Scuola normale superiore di Pisa,AJA
319,AnnRepCypr,Annual Report of the Director of the Department of Antiquities, Republic of Cyprus,AJA
320,AnnTor,Annuario della Accademia delle scienze di Torino,AJA
321,ANSMN,American Numismatic Society Museum Notes,AJA
322,Antaeus,Antaeus: Mitteilungen des Archäologischen Instituts der Ungarischen Akademie der Wissenschaften,AJA
323,AntAfr,Antiquités africaines,AJA
324,AntCl,L’Antiquité classique,AJA
325,AntDenk,Antike Denkmäler,AJA
326,AntHung,Antiquitas Hungarica,AJA
327,Antiquity,Antiquity: A Quarterly Review of Archaeology,AJA
328,AntJ,The Antiquaries Journal,AJA
329,AntK,Antike Kunst,AJA
330,AntK-BH,Antike Kunst: Beiheft,AJA
331,AntP,Antike Plastik,AJA
332,AntW,Antike Welt: Zeitschrift für Archäologie und Kulturgeschichte,AJA
333,AnzAW,Anzeiger für die Altertumswissenschaft,AJA
334,AnzSchweiz,Anzeiger für schweizerische Altertumskunde,AJA
335,AnzWien,Anzeiger: Österreichische Akademie der Wissenschaften, Wien, Philologisch-historische Klasse,AJA
336,AOAT,Alter Orient und Altes Testament,AJA
337,Apulum,Apulum: Acta Musei Apulensis,AJA
338,AquilNost,Aquileia nostra,AJA
339,AR,Archaeological Reports (supplement to JHS),AJA
340,Archaeology,Archaeology Magazine,AJA
341,Archaeometry,Archaeometry: Bulletin of the Research Laboratory for Archaeology and the History of Art, Oxford University,AJA
342,ArchAnthrop,Archiv für Anthropologie,AJA
343,ArchAusgr,Archäologische Ausgrabungen,AJA
344,ArchAustr,Archaeologia austriaca,AJA
345,ArchCl,Archeologia classica,AJA
346,ArchDelt,Archaiologikon Deltion,AJA
347,ArcheologiaPar,Archeologia: Trésors des âges (Paris),AJA
348,ArcheologiaRom,Archeologia: Rivista bimestrale (Rome),AJA
349,ArcheologiaWar,Archeologia: Rocznik Instytutu historii kultury materialnej Polskiej akademii nauk (Warsaw),AJA
350,ArchEph,Archaiologike Ephemeris,AJA
351,ArchErt,Archaeologiai ertesítö,AJA
352,ArchEsp,Archivo español de arte y arqueología,AJA
353,ArchEspArq,Archivo español de arqueología,AJA
354,ArchEspArt,Archivo español de arte,AJA
355,ArchGeogr,Archaeologia geographica,AJA
356,ArchInf,Archäologische Informationen: Mitteilungen zur Ur- und Frühgeschichte,AJA
357,Architectura,Architectura: Zeitschrift für Geschichte der Baukunst,AJA
358,ArchIug,Archaeologia iugoslavica,AJA
